{
  "schemaVersion": "agentchef.install-plan.v2",
  "description": "Codex-only install surface used for dry-run planning, validation, and collision review. Profiles select the base operation set; every resolved plan uses the canonical operations-array order, with optional Git guards and curated skills completed before the terminal plugin-cache refresh. Every operation names its target: codex, claude, or shared (runs once for any selected target).",
  "profiles": {
    "default": [
      "codex-agents-md",
      "codex-config",
      "codex-profile-launcher",
      "codex-serena-pool",
      "codex-rules",
      "codex-agents",
      "codex-profiles",
      "codex-mcp-profiles",
      "codex-plugin",
      "codex-plugin-marketplace-source",
      "plugin-marketplace",
      "installed-plugin-cache-refresh",
      "claude-working-agreement",
      "claude-serena-pool",
      "claude-settings-merge",
      "claude-mcp-merge",
      "claude-plugin-marketplace",
      "claude-plugin-register"
    ],
    "all": [
      "codex-agents-md",
      "codex-config",
      "codex-profile-launcher",
      "codex-serena-pool",
      "codex-rules",
      "codex-agents",
      "codex-profiles",
      "codex-mcp-profiles",
      "codex-plugin",
      "codex-plugin-marketplace-source",
      "plugin-marketplace",
      "curated-skills",
      "installed-plugin-cache-refresh",
      "claude-working-agreement",
      "claude-serena-pool",
      "claude-settings-merge",
      "claude-mcp-merge",
      "claude-plugin-marketplace",
      "claude-plugin-register"
    ]
  },
  "operations": [
    {
      "id": "codex-agents-md",
      "kind": "copy-file",
      "target": "codex",
      "summary": "Install durable global Codex guidance.",
      "source": "templates/codex/AGENTS.md",
      "destination": "${CODEX_HOME}/AGENTS.md",
      "platforms": [
        "windows",
        "unix"
      ],
      "collision": "skip-unless-force-backup-before-replace",
      "backup": true,
      "risk": "medium",
      "conflictPolicy": "Global guidance can affect every repo. External repos keep precedence through repo-local AGENTS.md files."
    },
    {
      "id": "codex-config",
      "kind": "copy-file",
      "target": "codex",
      "summary": "Install Codex config template for the current platform.",
      "sourceByPlatform": {
        "windows": "templates/codex/config.windows.toml",
        "unix": "templates/codex/config.unix.toml"
      },
      "destination": "${CODEX_HOME}/config.toml",
      "platforms": [
        "windows",
        "unix"
      ],
      "collision": "merge-missing-blocks-unless-force-backup-before-replace",
      "backup": true,
      "risk": "medium",
      "conflictPolicy": "Canonical template plus user-owned overlay: existing model, profile, approval, sandbox, project trust, and unrelated MCP values are preserved outside Force. AgentChef-managed agent/MCP safety tables are synchronized explicitly; Force replaces the file only after backup."
    },
    {
      "id": "codex-profile-launcher",
      "kind": "copy-file",
      "target": "codex",
      "summary": "Install the profile launcher used to compose managed MCP profiles.",
      "source": "templates/codex/codex-profile.mjs",
      "destination": "${CODEX_HOME}/codex-profile.mjs",
      "platforms": [
        "windows",
        "unix"
      ],
      "collision": "skip-unless-force-backup-before-replace",
      "backup": true,
      "risk": "medium",
      "conflictPolicy": "The launcher is a managed local helper and is replaced only after backup when force or update synchronization is explicitly selected."
    },
    {
      "id": "codex-serena-pool",
      "kind": "copy-file",
      "target": "codex",
      "summary": "Install the lazy project-keyed Serena pool bridge.",
      "source": "templates/codex/serena-pool.mjs",
      "destination": "${CODEX_HOME}/serena-pool.mjs",
      "platforms": [
        "windows",
        "unix"
      ],
      "collision": "skip-unless-force-backup-before-replace",
      "backup": true,
      "risk": "medium",
      "conflictPolicy": "The bridge is local-only, starts no Serena/LSP until an allowlisted semantic tool is used, and never stores a token in repository content or config."
    },
    {
      "id": "codex-rules",
      "kind": "copy-file",
      "target": "codex",
      "summary": "Install conservative default command-approval rules.",
      "source": "templates/codex/rules/default.rules",
      "destination": "${CODEX_HOME}/rules/default.rules",
      "platforms": [
        "windows",
        "unix"
      ],
      "collision": "skip-unless-force-backup-before-replace",
      "backup": true,
      "risk": "medium",
      "conflictPolicy": "Rules allow narrow verification commands and keep destructive/publish actions approval-gated."
    },
    {
      "id": "codex-agents",
      "kind": "copy-glob",
      "target": "codex",
      "summary": "Install specialist subagent definitions.",
      "sourceGlob": "templates/codex/agents/*.toml",
      "destinationDir": "${CODEX_HOME}/agents",
      "platforms": [
        "windows",
        "unix"
      ],
      "collision": "skip-unless-force-backup-before-replace",
      "backup": true,
      "risk": "medium",
      "conflictPolicy": "Specialists stay narrow; do not import external repo-specific agent fleets into global defaults."
    },
    {
      "id": "codex-profiles",
      "kind": "copy-glob",
      "target": "codex",
      "summary": "Install named Codex profile files.",
      "sourceGlob": "templates/codex/profiles/*.toml",
      "excludeBasenames": [
        "team-worker.config.toml",
        "full.config.toml",
        "multi-session.config.toml",
        "offline.config.toml"
      ],
      "destinationDir": "${CODEX_HOME}",
      "platforms": [
        "windows",
        "unix"
      ],
      "collision": "skip-unless-force-backup-before-replace",
      "backup": true,
      "risk": "medium",
      "conflictPolicy": "Profiles stay separate files and avoid mixing beta permission profiles with legacy sandbox settings."
    },
    {
      "id": "codex-mcp-profiles",
      "kind": "generate-mcp-profile",
      "target": "codex",
      "summary": "Generate full, multi-session, and offline profiles from the installed config while preserving user overrides.",
      "sources": [
        "templates/codex/profiles/full.config.toml",
        "templates/codex/profiles/multi-session.config.toml",
        "templates/codex/profiles/offline.config.toml"
      ],
      "destinationDir": "${CODEX_HOME}",
      "configSource": "${CODEX_HOME}/config.toml",
      "platforms": [
        "windows",
        "unix"
      ],
      "collision": "generate-merged-profile-backup-before-replace",
      "backup": true,
      "risk": "medium",
      "conflictPolicy": "Generated profiles are composed with the installed config so profile-specific MCP enablement remains current without discarding preserved user-owned config values."
    },
    {
      "id": "codex-plugin",
      "kind": "copy-directory",
      "target": "codex",
      "summary": "Install the local workflow plugin bundle and its three reviewed hooks: the Agent spawn guard, the routing hint, and the SessionEnd process-hygiene sweep.",
      "source": "plugins/agentchef",
      "destination": "${CODEX_HOME}/plugins/agentchef",
      "platforms": [
        "windows",
        "unix"
      ],
      "collision": "sync-managed-files-preserve-extras-backup-before-sync",
      "backup": true,
      "risk": "medium",
      "conflictPolicy": "Managed plugin files are refreshed after backup while extra files are preserved by default; destructive pruning requires an explicit repair flag, and Codex hook trust remains a separate exact-source user review."
    },
    {
      "id": "codex-plugin-marketplace-source",
      "kind": "copy-directory",
      "target": "shared",
      "summary": "Mirror the local workflow plugin inside the personal marketplace root.",
      "source": "plugins/agentchef",
      "destination": "${AGENTS_HOME}/plugins/sources/agentchef",
      "platforms": [
        "windows",
        "unix"
      ],
      "collision": "sync-managed-files-preserve-extras-backup-before-sync",
      "backup": true,
      "risk": "medium",
      "conflictPolicy": "The marketplace source stays inside the marketplace root required by current Codex schema, so independently customized CODEX_HOME and AGENTS_HOME values remain portable."
    },
    {
      "id": "plugin-marketplace",
      "kind": "write-marketplace",
      "target": "codex",
      "summary": "Register the local workflow plugin in the personal marketplace file.",
      "destination": "${AGENTS_HOME}/plugins/marketplace.json",
      "pluginTarget": "${AGENTS_HOME}/plugins/sources/agentchef",
      "platforms": [
        "windows",
        "unix"
      ],
      "collision": "upsert-entry-with-backup",
      "backup": true,
      "risk": "medium",
      "conflictPolicy": "Only the AgentChef plugin entry is added or updated after backup; unrelated marketplace plugins are preserved and invalid marketplace JSON fails closed."
    },
    {
      "id": "git-ignore-global",
      "kind": "copy-file",
      "target": "shared",
      "summary": "Optionally install global Git ignore rules.",
      "source": "templates/git/.gitignore_global",
      "destination": "${HOME}/.gitignore_global",
      "adoptionFlag": "AdoptGitIgnore",
      "stateBackup": "agentchef.global-git-guards-receipt@1",
      "requiresFlag": "InstallGitGuards",
      "platforms": [
        "windows",
        "unix"
      ],
      "collision": "fail-on-foreign-existing-unless-explicit-adoption-backup-before-replace",
      "backup": true,
      "risk": "medium",
      "conflictPolicy": "A foreign existing ignore file fails closed unless AdoptGitIgnore is explicitly selected; adoption records exact prior file state in the Git-guard receipt before replacement."
    },
    {
      "id": "git-pre-commit-hook",